id,title,release_date,overview,popularity,vote_average,vote_count,Adventure,Fantasy,Animation,Drama,Horror,Action,Comedy,History,Western,Thriller,Crime,Documentary,Science Fiction,Mystery,Music,Romance,Family,War,TV Movie
801688,kalki 2898ad,2024,in the year 2898 ad around 6000 years after kurukshetra war ashwatthama gears up for his final battle of redemption at the sign of hope in a dystopian world and bhairava a wisecracking and selfinterested bounty hunter tired of the perilous life becomes the hurdle in the process,11.2069,6.448,126,0,1,0,1,0,1,0,0,0,0,0,0,1,0,0,0,0,0,0
474350,it chapter two,2019,27 years after overcoming the malevolent supernatural entity pennywise the former members of the losers club who have grown up and moved away from derry are brought back together by a devastating phone call,11.2045,6.835,8958,0,0,0,0,1,0,0,0,0,1,0,0,0,0,0,0,0,0,0
263115,logan,2017,in the near future a weary logan cares for an ailing professor x in a hideout on the mexican border but logans attempts to hide from the world and his legacy are upended when a young mutant arrives pursued by dark forces,11.2011,7.8,19658,0,0,0,1,0,1,0,0,0,0,0,0,1,0,0,0,0,0,0
297762,wonder woman,2017,an amazon princess comes to the world of man in the grips of the first world war to confront the forces of evil and bring an end to human conflict,11.1717,7.217,20262,1,1,0,0,0,1,0,0,0,0,0,0,0,0,0,0,0,0,0
1146210,housefull 5a,2025,a father writes his will  his son jolly is going to get it all but who is jolly the comedy unfolds as different people pose as the real jolly on a cruise celebrating the fathers birthday  where a murder takes place,11.1639,4.8,4,0,0,0,0,0,0,1,0,0,1,0,0,0,1,0,0,0,0,0
1051896,arcadian,2024,in the near future on a decimated earth paul and his twin sons face terror at night when ferocious creatures awaken when paul is nearly killed the boys come up with a plan for survival using everything their father taught them to keep him alive,11.1596,6.106,690,0,0,0,0,1,1,0,0,0,1,0,0,1,0,0,0,0,0,0
1147400,miraculous world paris tales of shadybug and claw noir,2023,miraculous holders from another world appear in paris they come from a parallel universe where everything is reversed the holders of ladybug and black cat miraculouses shadybug and claw noir are the bad guys and the holder of the butterfly miraculous hesperia is a superhero ladybug and cat noir will have to help hesperia counter the attacks of their evil doubles and prevent them from seizing the butterflys miraculous can our heroes also help hesperia make shadybug and claw noir better people,11.1566,7.245,604,1,1,1,0,0,1,0,0,0,0,0,0,0,0,0,0,1,0,0
207,dead poets society,1989,at an elite oldfashioned boarding school in new england a passionate english teacher inspires his students to rebel against convention and seize the potential of every day courting the disdain of the stern headmaster,11.1463,8.302,11692,0,0,0,1,0,0,0,0,0,0,0,0,0,0,0,0,0,0,0
114,pretty woman,1990,while on a business trip in los angeles edward lewis a millionaire entrepreneur who makes a living buying and breaking up companies picks up a prostitute vivian while asking for directions after edward hires vivian to stay with him for the weekend to accompany him to a few social events and the two get closer only to discover there are significant hurdles to overcome as they try to bridge the gap between their very different worlds,11.1427,7.463,8532,0,0,0,0,0,0,1,0,0,0,0,0,0,0,0,1,0,0,0
3110,shane,1953,a weary gunfighter attempts to settle down with a homestead family but a smouldering settler and rancher conflict forces him to act,11.1327,7.363,632,0,0,0,1,0,0,0,0,1,0,0,0,0,0,0,0,0,0,0
345940,the meg,2018,a deep sea submersible pilot revisits his past fears in the mariana trench and accidentally unleashes the seventy foot ancestor of the great white shark believed to be extinct,11.1133,6.248,7836,0,0,0,0,1,1,0,0,0,0,0,0,1,0,0,0,0,0,0
50546,just go with it,2011,while romancing palmer a much younger schoolteacher plastic surgeon danny maccabee enlists his loyal assistant katherine to pretend to be his soon to be exwife in order to cover up a careless lie when more lies backfire katherines kids become involved and everyone heads off for a weekend in hawaii that will change all their lives,11.113,6.704,5841,0,0,0,0,0,0,1,0,0,0,0,0,0,0,0,1,0,0,0
1124,the prestige,2006,a mysterious story of two magicians whose intense rivalry leads them on a lifelong battle for supremacy  full of obsession deceit and jealousy with dangerous and deadly consequences,11.1044,8.204,16569,0,0,0,1,0,0,0,0,0,0,0,0,1,1,0,0,0,0,0
436969,the suicide squad,2021,supervillains harley quinn bloodsport peacemaker and a collection of nutty cons at belle reve prison join the supersecret supershady task force x as they are dropped off at the remote enemyinfused island of corto maltese,11.1011,7.5,8936,1,0,0,0,0,1,1,0,0,0,0,0,0,0,0,0,0,0,0
1128650,the prosecutor,2024,a poor young man is wrongly charged with drug trafficking after being deceived an exprosecutor investigates the case uncovers a corrupt lawyer teams scheme and restores justice despite obstruction from evil forces,11.0995,7.1,55,0,0,0,1,0,1,0,0,0,1,1,0,0,0,0,0,0,0,0
613504,after we collided,2020,tessa finds herself struggling with her complicated relationship with hardin she faces a dilemma that could change their lives forever,10.9989,7.168,5380,0,0,0,1,0,0,0,0,0,0,0,0,0,0,0,1,0,0,0
1333100,attack on titan the last attack,2024,a colossalsized omnibus film bringing together the last two episodes of attack on titan in the franchises firstever theatrical experience after venturing beyond the walls and separated from his comrades eren finds himself inspired by this new truth and plots the rumbling a terrifying plan to eradicate every living thing in the world with the fate of the world hanging in the balance a motley crew of erens former comrades and enemies scramble to halt his deadly mission the only question is can they stop him,10.897,8.756,80,1,1,1,0,0,1,0,0,0,0,0,0,0,0,0,0,0,0,0
98022,amazing love,2012,teen friends steve carrie cooper and gameboy embark on a weekend camping trip lead by their church youth group leader stuart and his wife beth joining them is an outsider ashley a selfinvolved rich kid whose attitude causes a major commotion within the group specifically between her and carrie before it gets too out of hand though stuart takes this opportunity to share with the kids the incredibly powerful biblical story of hosea a story of immovable faith impeccable commitment and impervious love,10.2506,6.75,24,0,0,0,1,0,0,0,0,0,0,0,0,0,0,0,0,0,0,0
588648,dragonkeeper,2024,set in han imperial china the plot follows the adventures of enslaved girl ping with ancient dragon long danzi dragons had been banished from the kingdom ping an orphan finds one of the last remaining dragon eggs palace guards force ping to run away in order to return the dragon egg to the ocean and save all dragons from extinction ping discovers that she is a true dragonkeeper,10.6859,7.653,189,1,1,1,0,0,1,0,0,0,0,0,0,0,0,0,0,1,0,0
281338,war for the planet of the apes,2017,caesar and his apes are forced into a deadly conflict with an army of humans led by a ruthless colonel after the apes suffer unimaginable losses caesar wrestles with his darker instincts and begins his own mythic quest to avenge his kind as the journey finally brings them face to face caesar and the colonel are pitted against each other in an epic battle that will determine the fate of both their species and the future of the planet,9.5907,7.207,9276,0,0,0,1,0,0,0,0,0,0,0,0,1,0,0,0,0,1,0
646385,scream,2022,twentyfive years after a streak of brutal murders shocked the quiet town of woodsboro a new killer has donned the ghostface mask and begins targeting a group of teenagers to resurrect secrets from the towns deadly past,10.0724,6.7,3486,0,0,0,0,1,0,0,0,0,0,0,0,0,1,0,0,0,0,0
1138749,the island,2023,when his brother is killed lapd officer mark leaves the city to return to the island he grew up on seeking answers and ultimately vengeance he soon finds himself in a bloody battle with the corrupt tycoon whos taken over the island paradise,10.7011,6.2,88,0,0,0,0,0,1,0,0,0,1,1,0,0,0,0,0,0,0,0
1103432,bloody escape bats out of hell,2024,after being turned into a cyborg kisaragi faces pursuit from vampires and vengeful yakuza,10.7459,6.6,7,0,0,1,0,0,1,0,0,0,0,0,0,1,0,0,0,0,0,0
301528,toy story 4,2019,woody has always been confident about his place in the world and that his priority is taking care of his kid whether thats andy or bonnie but when bonnie adds a reluctant new toy called forky to her room a road trip adventure alongside old and new friends will show woody how big the world can be for a toy,11.2382,7.476,10027,1,1,1,0,0,0,1,0,0,0,0,0,0,0,0,0,1,0,0
68721,iron man 3,2013,when tony starks world is torn apart by a formidable terrorist called the mandarin he starts an odyssey of rebuilding and retribution,11.231,6.93,22604,1,0,0,0,0,1,0,0,0,0,0,0,1,0,0,0,0,0,0
508442,soul,2020,joe gardner is a middle school teacher with a love for jazz music after a successful audition at the half note club he suddenly gets into an accident that separates his soul from his body and is transported to the you seminar a center in which souls develop and gain passions before being transported to a newborn child joe must enlist help from the other soulsintraining like 22 a soul who has spent eons in the you seminar in order to get back to earth,11.2651,8.108,10806,0,1,1,0,0,0,1,0,0,0,0,0,0,0,0,0,1,0,0
45243,the hangover part ii,2011,the hangover crew heads to thailand for stus wedding after the disaster of a bachelor party in las vegas last year stu is playing it safe with a mellow prewedding brunch however nothing goes as planned and bangkok is the perfect setting for another adventure with the rowdy group,11.2744,6.488,10738,0,0,0,0,0,0,1,0,0,0,0,0,0,0,0,0,0,0,0
539,psycho,1960,when larcenous real estate clerk marion crane goes on the lam with a wad of cash and hopes of starting a new life she ends up at the notorious bates motel where manager norman bates cares for his housebound mother,10.026,8.422,10390,0,0,0,0,1,0,0,0,0,1,0,0,0,1,0,0,0,0,0
1226578,longlegs,2024,fbi agent lee harker is a gifted new recruit assigned to the unsolved case of an elusive serial killer as the case takes complex turns unearthing evidence of the occult harker discovers a personal connection to the merciless killer and must race against time to stop him before he claims the lives of another innocent family,10.3966,6.561,2093,0,0,0,0,1,0,0,0,0,1,1,0,0,0,0,0,0,0,0
710295,wolf man,2025,with his marriage fraying blake persuades his wife charlotte to take a break from the city and visit his remote childhood home in rural oregon as they arrive at the farmhouse in the dead of night theyre attacked by an unseen animal and barricade themselves inside the home as the creature prowls the perimeter but as the night stretches on blake begins to behave strangely transforming into something unrecognizable,10.6948,6.351,651,0,0,0,0,1,0,0,0,0,1,0,0,0,0,0,0,0,0,0
207703,kingsman the secret service,2015,the story of a supersecret spy organization that recruits an unrefined but promising street kid into the agencys ultracompetitive training program just as a global threat emerges from a twisted tech genius,10.5524,7.626,17118,1,0,0,0,0,1,1,0,0,0,1,0,0,0,0,0,0,0,0
346910,the predator,2018,when a young boy accidentally triggers the universes most lethal hunters return to earth only a ragtag crew of exsoldiers and a disgruntled scientist can prevent the end of the human race,10.9196,5.628,4815,0,0,0,0,0,1,0,0,0,1,0,0,1,0,0,0,0,0,0
10184,hes just not that into you,2009,have you ever sat by the phone wondering why he said he would call but didnt or you cant figure out why she doesnt want to sleep with you anymore or why your relationship just isnt going to the next level theyre just not that into you gigi just wants a man who says hell calland doeswhile alex advises her to stop waiting by the phone beth wants a proposal after years of a committed relationship with her boyfriend neil who sees nothing  wrong with the status quo janines not sure if she can trust her husband ben who cant quite trust himself around anna anna cant decide between the sexy married guy or her straightforward nosparks standby conor who cant get over the fact that he cant have her and mary whos found an entire network of loving supportive men just needs to find one whos straight,10.9133,6.608,3833,0,0,0,1,0,0,1,0,0,0,0,0,0,0,0,1,0,0,0
338953,fantastic beasts the secrets of dumbledore,2022,professor albus dumbledore knows the powerful dark wizard gellert grindelwald is moving to seize control of the wizarding world unable to stop him alone he entrusts magizoologist newt scamander to lead an intrepid team of wizards and witches they soon encounter an array of old and new beasts as they clash with grindelwalds growing legion of followers,10.906,6.638,4727,1,1,0,0,0,0,0,0,0,0,0,0,0,0,0,0,0,0,0
679,aliens,1986,ripley the sole survivor of the nostromos deadly encounter with the monstrous alien returns to earth after drifting through space in hypersleep for 57 years although her story is initially met with skepticism she agrees to accompany a team of colonial marines back to lv426,10.8985,7.954,10153,0,0,0,0,0,1,0,0,0,1,0,0,1,0,0,0,0,0,0
286217,the martian,2015,during a manned mission to mars astronaut mark watney is presumed dead after a fierce storm and left behind by his crew but watney has survived and finds himself stranded and alone on the hostile planet with only meager supplies he must draw upon his ingenuity wit and spirit to subsist and find a way to signal to earth that he is alive,10.8918,7.689,20220,1,0,0,1,0,0,0,0,0,0,0,0,1,0,0,0,0,0,0
408,snow white and the seven dwarfs,1938,a beautiful girl snow white takes refuge in the forest in the house of seven dwarfs to hide from her stepmother the wicked queen the queen is jealous because she wants to be known as the fairest in the land and snow whites beauty surpasses her own,10.8802,7.123,7636,0,1,1,0,0,0,0,0,0,0,0,0,0,0,0,0,1,0,0
1813,the devils advocate,1997,aspiring florida defense lawyer kevin lomax accepts a job at a new york law firm with the stakes getting higher every case kevin quickly learns that his boss has something far more evil planned,10.8789,7.467,6257,0,0,0,1,1,0,0,0,0,1,0,0,0,1,0,0,0,0,0
18,the fifth element,1997,in 2257 a taxi driver is unintentionally given the task of saving a young girl who is part of the key that will ensure the survival of humanity,10.8717,7.6,11057,1,0,0,0,0,1,0,0,0,0,0,0,1,0,0,0,0,0,0
1359,american psycho,2000,a wealthy new york investment banking executive hides his alternate psychopathic ego from his coworkers and friends as he escalates deeper into his illogical gratuitous fantasies,10.8597,7.405,11423,0,0,0,1,0,0,0,0,0,1,1,0,0,0,0,0,0,0,0
1579,apocalypto,2006,set in the mayan civilization when a mans idyllic presence is brutally disrupted by a violent invading force he is taken on a perilous journey to a world ruled by fear and oppression where a harrowing end awaits him through a twist of fate and spurred by the power of his love for his woman and his family he will make a desperate break to return home and to ultimately save his way of life,10.8486,7.6,5787,0,0,0,1,0,1,0,1,0,0,0,0,0,0,0,0,0,0,0
1212121,latin blood  the ballad of ney matogrosso,2025,homem com h moves between the different phases of singer ney matogrossos career going through his childhood adolescence adulthood and maturity the film is a journey through time and follows a boy from humble origins who is passionate about nature who frees himself from oppression and authority figures breaks prejudices and becomes one of the most influential artists of his generation,10.8087,8.9,24,0,0,0,1,0,0,0,0,0,0,0,0,0,0,1,0,0,0,0
989238,no love lost,2023,tienne is barely twenty when he falls in love with valrie they are hardly any more when their daughter rosa is born and then one day valrie leaves and never returns he chooses not to make a drama of it and builds a happy life for him and his child sixteen years later when rosa is about to lead her own life tienne recognizes his wife in a television report the past brutally resurfaces and father and daughter are propelled into one last chaotic family journey,10.8013,6.021,47,0,0,0,1,0,0,1,0,0,0,0,0,0,0,0,0,0,0,0
650033,free fall,2025,in the near future humanity has successfully colonized space and build a giant orbital station delta max is a repairman working on the station after a disaster caused by a proton storm he is left alone without his crew members drifting into space his space suit is broken he is exhausted and he lacks communication with people but suddenly a dispatcher named anna comes to help she is the only one who can guide max through difficulties and get him to the station max has to risk everything to save his life but he has no idea what anna is up to,10.7772,5.563,8,0,0,0,0,0,0,0,0,0,1,0,0,1,0,0,0,0,0,0
493922,hereditary,2018,following the death of the leigh family matriarch annie and her children uncover disturbing secrets about their heritage their daily lives are not only impacted but they also become entangled in a chilling fate from which they cannot escape driving them to the brink of madness,10.7759,7.3,7985,0,0,0,0,1,0,0,0,0,1,0,0,0,1,0,0,0,0,0
127585,xmen days of future past,2014,the ultimate xmen ensemble fights a war for the survival of the species across two time periods as they join forces with their younger selves in an epic battle that must change the past  to save our future,10.9644,7.529,15617,1,0,0,0,0,1,0,0,0,0,0,0,1,0,0,0,0,0,0
353486,jumanji welcome to the jungle,2017,four teenagers in detention discover an old video game console with a game theyve never heard of when they decide to play they are immediately sucked into the jungle world of jumanji in the bodies of their avatars theyll have to complete the adventure of their lives filled with fun thrills and danger or be stuck in the game forever,8.5976,6.821,13918,1,1,0,0,0,1,1,0,0,0,0,0,0,0,0,0,1,0,0
4247,scary movie,2000,a familiarlooking group of teenagers find themselves being stalked by a morethanvaguely recognizable masked killer as the victims begin to pile up and the laughs pile on none of your favorite scary movies escape the razorsharp satire of this outrageously funny parody,10.7681,6.4,7203,0,0,0,0,0,0,1,0,0,0,0,0,0,0,0,0,0,0,0
1402859,quarantine,2025,describing herself as a trouble magnet zeynep finds herself in the middle of chaos on her first day at her new school an outbreak forces the school into lockdown and that night she stumbles upon the lifeless body of a female student in the dark hallways shes not aloneshes joined by onur zorlu the school principals son and his friends burak and mert fearing his fathers weak heart wont handle the news of a murder onur proposes they keep it a secret until the quarantine is lifted and find the killer themselves with a disease outbreak and a murderer on the loose the group believes their only option is to solve the mystery without alarming the parents outside drawn into this dangerous plan zeynep becomes the fourth unexpected member of their group together they embark on a perilous journey full of secrets danger and twists they never saw coming,10.1562,6.5,6,0,0,0,1,0,0,0,0,0,0,1,0,0,0,0,0,0,0,0
37135,tarzan,1999,tarzan was a small orphan who was raised by an ape named kala since he was a child he believed that this was his family but on an expedition jane porter is rescued by tarzan he then finds out that hes human now tarzan must make the decision as to which family he should belong to,10.7352,7.396,6961,1,0,1,1,0,0,0,0,0,0,0,0,0,0,0,0,1,0,0
341174,fifty shades darker,2017,when a wounded christian grey tries to entice a cautious ana steele back into his life she demands a new arrangement before she will give him another chance as the two begin to build trust and find stability shadowy figures from christians past start to circle the couple determined to destroy their hopes for a future together,9.9643,6.483,7741,0,0,0,1,0,0,0,0,0,0,0,0,0,0,0,1,0,0,0
62,2001 a space odyssey,1968,humanity finds a mysterious object buried beneath the lunar surface and sets off to find its origins with the help of hal 9000 the worlds most advanced super computer,9.6373,8.1,11876,1,0,0,0,0,0,0,0,0,0,0,0,1,1,0,0,0,0,0
1189423,the sloth lane,2024,after a terrifying storm destroys their home a speedy sloth named laura and her kooky family move to the big city in their rusted old food truck gordito hoping to make their business a success the familys delicious food catches the eye of a quickwitted cheetah who will stop at nothing to revive her failing fastfood business,10.516,6.275,20,0,0,1,0,0,0,0,0,0,0,0,0,0,0,0,0,1,0,0
337401,mulan,2020,when the emperor of china issues a decree that one man per family must serve in the imperial chinese army to defend the country from huns hua mulan the eldest daughter of an honored warrior steps in to take the place of her ailing father she is spirited determined and quick on her feet disguised as a man by the name of hua jun she is tested every step of the way and must harness her innermost strength and embrace her true potential,8.642,6.861,6805,1,1,0,0,0,1,0,0,0,0,0,0,0,0,0,0,0,0,0
893723,paw patrol the mighty movie,2023,a magical meteor crash lands in adventure city and gives the paw patrol pups superpowers transforming them into the mighty pups,9.9141,7.039,492,1,0,1,0,0,0,1,0,0,0,0,0,0,0,0,0,1,0,0
6479,i am legend,2007,robert neville is a scientist who was unable to stop the spread of the terrible virus that was incurable and manmade immune neville is now the last human survivor in what is left of new york city and perhaps the world for three years neville has faithfully sent out daily radio messages desperate to find any other survivors who might be out there but he is not alone,9.987,7.209,16092,0,0,0,1,0,0,0,0,0,1,0,0,1,0,0,0,0,0,0
420634,terrifier,2018,a maniacal clown named art terrorizes three young women on halloween night and everyone else who stands in his way,10.7594,6.341,2694,0,0,0,0,1,0,0,0,0,1,0,0,0,0,0,0,0,0,0
1143407,sky force,2025,in the 1965 indopak war india faces a devastating surprise attack wing commander ahuja leads a retaliatory strike but squadron leader vijaya goes missing after a heroic solo engagement against a superior enemy jet ahuja spends 23 years seeking the truth and uncovering a coverup,10.1091,6.4,34,0,0,0,0,0,1,0,1,0,1,0,0,0,0,0,0,0,1,0
1195430,deva,2025,dev ambre a ruthless cop loses his memory in an accident just after he has finished solving a murder case and now has to reinvestigate it while keeping his memory loss a secret from everyone except dcp farhan khan,10.1492,5.922,51,0,0,0,0,0,1,0,0,0,1,1,0,0,1,0,0,0,0,0
744276,after ever happy,2022,as a shocking truth about a couples families emerges the two lovers discover they are not so different from each other tessa is no longer the sweet simple good girl she was when she met hardin  any more than he is the cruel moody boy she fell so hard for,10.2863,6.8,1281,0,0,0,1,0,0,0,0,0,0,0,0,0,0,0,1,0,0,0
1445276,a love too captivating,2025,misuzu was branded a delinquent when a small incident left him isolated but one day he sees the top student kitahara get surrounded by bullies and decides to help him out that sparked kitaharas interest in the lonely boy but misuzu pushes kitahara away if you get involved with me youll get ostracized by everyone else too but it wont take long for misuzus resolve to falter,9.9395,6.5,2,0,0,1,0,0,0,0,0,0,0,0,0,0,0,0,1,0,0,0
4247,scary movie,2000,a familiarlooking group of teenagers find themselves being stalked by a morethanvaguely recognizable masked killer as the victims begin to pile up and the laughs pile on none of your favorite scary movies escape the razorsharp satire of this outrageously funny parody,10.7681,6.369,7203,0,0,0,0,0,0,1,0,0,0,0,0,0,0,0,0,0,0,0
480530,creed ii,2018,between personal obligations and training for his next big fight against an opponent with ties to his familys past adonis creed is up against the challenge of his life,9.2027,7.033,5534,0,0,0,1,0,1,0,0,0,0,0,0,0,0,0,0,0,0,0
24,kill bill vol 1,2003,an assassin is shot by her ruthless employer bill and other members of their assassination circle  but she lives to plot her vengeance,10.7296,7.971,17906,0,0,0,0,0,1,0,0,0,0,1,0,0,0,0,0,0,0,0
398818,call me by your name,2017,in the summer of 1983 a 17yearold elio spends his days in his familys villa in italy one day oliver a graduate student arrives to assist elios father a professor of grecoroman culture soon elio and oliver discover a summer that will alter their lives forever,10.9563,8.1,12329,0,0,0,1,0,0,0,0,0,0,0,0,0,0,0,1,0,0,0
694,the shining,1980,jack torrance accepts a caretaker job at the overlook hotel where he along with his wife wendy and their son danny must live isolated from the rest of the world for the winter but they arent prepared for the madness that lurks within,10.6963,8.212,17985,0,0,0,0,1,0,0,0,0,1,0,0,0,0,0,0,0,0,0
324849,the lego batman movie,2017,a coolerthanever bruce wayne must deal with the usual suspects as they plan to rule gotham city while discovering that he has accidentally adopted a teenage orphan who wishes to become his sidekick,6.9205,7.226,5136,0,0,1,0,0,1,1,0,0,0,0,0,0,0,0,0,1,0,0
9023,spirit stallion of the cimarron,2002,a captured mustang remains determined to return to his herd no matter what,9.7731,7.693,4700,1,0,1,1,0,0,0,0,1,0,0,0,0,0,0,1,1,0,0
73723,the lorax,2012,a 12yearold boy searches for the one thing that will enable him to win the affection of the girl of his dreams to find it he must discover the story of the lorax the grumpy yet charming creature who fights to protect his world,10.5472,6.509,3671,0,0,1,0,0,0,0,0,0,0,0,0,0,0,0,0,1,0,0
