id,title,release_date,overview,popularity,vote_average,vote_count,Adventure,Fantasy,Animation,Drama,Horror,Action,Comedy,History,Western,Thriller,Crime,Documentary,Science Fiction,Mystery,Music,Romance,Family,War,TV Movie
980489,gran turismo,2023,the ultimate wishfulfillment tale of a teenage gran turismo player whose gaming skills won him a series of nissan competitions to become an actual professional racecar driver,13.003,7.753,2988,1,0,0,1,0,1,0,0,0,0,0,0,0,0,0,0,0,0,0
110415,snowpiercer,2013,in a future where a failed globalwarming experiment kills off most life on the planet a class system evolves aboard the snowpiercer a train that travels around the globe via a perpetualmotion engine,11.2833,6.905,9846,0,0,0,1,0,1,0,0,0,0,0,0,1,0,0,0,0,0,0
901121,cobweb,2023,in the 1970s director kim is obsessed by the desire to reshoot the ending of his completed film cobweb but chaos and turmoil grip the set with interference from the censorship authorities and the complaints of actors and producers who cant understand the rewritten ending will kim be able to find a way through this chaos to fulfill his artistic ambitions and complete his masterpiece,11.943,6.536,84,0,0,0,1,0,0,1,0,0,0,0,0,0,0,0,0,0,0,0
508883,the boy and the heron,2023,while the second world war rages the teenage mahito haunted by his mothers tragic death is relocated from tokyo to the serene rural home of his new stepmother natsuko a woman who bears a striking resemblance to the boys mother as he tries to adjust this strange new world grows even stranger following the appearance of a persistent gray heron who perplexes and bedevils mahito dubbing him the longawaited one,10.7205,7.434,2214,1,1,1,1,0,0,0,0,0,0,0,0,0,0,0,0,1,0,0
257094,holland,2025,teacher nancys life with her husband in holland michigan tumbles into a twisted tale when she and a colleague become suspicious of a secret,10.7421,5.381,373,0,0,0,0,0,0,0,0,0,1,0,0,0,1,0,0,0,0,0
793058,hifive,2025,wanseo is a girl who trains in taekwondo jisung is an aspiring writer seonnyeo is a yogurt fresh manager yakseon is a construction foreman and kidong is a jobless hipster they each receive a heart lungs kidneys liver and corneas respectively from a mysterious organ donor but along with their new healthier bodies come unexpected superpowers eventually they cross paths and recognize each other by unique markings on their bodies they decide to form a team but with different abilities personalities and tastes they constantly find themselves in arguments and accidents meanwhile youngchun a religious cult leader who also received a pancreas transplant from the same donor gained special abilities he is determined to find the other transplant recipients to collect all their superpowers for himself aiming to become almighty and immortal,13.2082,6.0,1,0,1,0,0,0,1,1,0,0,0,0,0,1,0,0,0,0,0,0
419430,get out,2017,chris and his girlfriend rose go upstate to visit her parents for the weekend at first chris reads the familys overly accommodating behavior as nervous attempts to deal with their daughters interracial relationship but as the weekend progresses a series of increasingly disturbing discoveries lead him to a truth that he never could have imagined,12.7808,7.619,17920,0,0,0,0,1,0,0,0,0,1,0,0,0,1,0,0,0,0,0
1261050,the quiet ones,2024,in 2008 a group of men from denmark and across europe pull off the biggest heist of all time on danish soil kasper a boxer with few chances left in life is offered the opportunity to plan the robbery by its foreign initiators,11.825,5.865,48,0,0,0,1,0,1,0,0,0,0,0,0,0,0,0,0,0,0,0
1013601,the alto knights,2025,two of new yorks most notorious organized crime bosses frank costello and vito genovese vie for control of the citys streets once the best of friends petty jealousies and a series of betrayals place them on a deadly collision course that will reshape the mafia and america forever,12.9622,6.254,207,0,0,0,1,0,0,0,1,0,0,1,0,0,0,0,0,0,0,0
953,madagascar,2005,four animal friends get a taste of the wild life when they break out of captivity at the central park zoo and wash ashore on the island of madagascar,12.9138,6.911,11150,1,0,1,0,0,0,1,0,0,0,0,0,0,0,0,0,1,0,0
718930,bullet train,2022,unlucky assassin ladybug is determined to do his job peacefully after one too many gigs gone off the rails fate however may have other plans as ladybugs latest mission puts him on a collision course with lethal adversaries from around the globeall with connected yet conflicting objectiveson the worlds fastest train,12.8986,7.435,6701,0,0,0,0,0,1,1,0,0,1,0,0,0,0,0,0,0,0,0
917496,beetlejuice beetlejuice,2024,after a family tragedy three generations of the deetz family return home to winter river still haunted by betelgeuse lydias life is turned upside down when her teenage daughter astrid accidentally opens the portal to the afterlife,12.7865,7.008,2587,0,1,0,0,1,0,1,0,0,0,0,0,0,0,0,0,0,0,0
746036,the fall guy,2024,fresh off an almost careerending accident stuntman colt seavers has to track down a missing movie star solve a conspiracy and try to win back the love of his life while still doing his day job,12.7416,7.016,3027,0,0,0,1,0,1,1,0,0,0,0,0,0,0,0,1,0,0,0
10192,shrek forever after,2010,a bored and domesticated shrek pacts with dealmaker rumpelstiltskin to get back to feeling like a real ogre again but when hes duped and sent to a twisted version of far far awaywhere rumpelstiltskin is king ogres are hunted and he and fiona have never methe sets out to restore his world and reclaim his true love,12.7412,6.383,7563,1,1,1,0,0,0,1,0,0,0,0,0,0,0,0,0,1,0,0
109418,grown ups 2,2013,lenny has relocated his family back to the small town where he and his friends grew up this time around the grown ups are the ones learning lessons from their kids on a day notoriously full of surprisesthe last day of school,12.7381,6.141,4439,0,0,0,0,0,0,1,0,0,0,0,0,0,0,0,0,0,0,0
646389,plane,2023,after a heroic job of successfully landing his stormdamaged aircraft in a war zone a fearless pilot finds himself between the agendas of multiple militias planning to take the plane and its passengers hostage,12.72,6.923,2387,1,0,0,0,0,1,0,0,0,1,0,0,0,0,0,0,0,0,0
438695,sing 2,2021,buster and his new cast now have their sights set on debuting a new show at the crystal tower theater in glamorous redshore city but with no connections he and his singers must sneak into the crystal entertainment offices run by the ruthless wolf mogul jimmy crystal where the gang pitches the ridiculous idea of casting the lion rock legend clay calloway in their show buster must embark on a quest to find the nowisolated clay and persuade him to return to the stage,12.6976,7.85,4545,0,0,1,0,0,0,1,0,0,0,0,0,0,0,1,0,1,0,0
49521,man of steel,2013,a young boy learns that he has extraordinary powers and is not of this earth as a young man he journeys to discover where he came from and what he was sent here to do but the hero in him must emerge if he is to save the world from annihilation and become the symbol of hope for all mankind,12.6794,6.633,15458,1,0,0,0,0,1,0,0,0,0,0,0,1,0,0,0,0,0,0
272,batman begins,2005,driven by tragedy billionaire bruce wayne dedicates his life to uncovering and defeating the corruption that plagues his home gotham city  unable to work within the system he instead creates a new identity a symbol of fear for the criminal underworld  the batman,12.6713,7.714,21525,0,0,0,1,0,1,0,0,0,0,1,0,0,0,0,0,0,0,0
615453,ne zha,2019,a young boy is born as the reincarnation of a demonic power into a society that hates and fears him destined by prophecy to bring destruction to the world nezha must choose between good and evil to see if he can change his fate,12.6582,7.908,528,1,1,1,0,0,0,0,0,0,0,0,0,0,0,0,0,0,0,0
1017129,detective chirp  the golden beehive,2022,residents of honey valley are getting ready for their favorite holiday  city day when all citizens have the opportunity to admire a unique artifact  the golden hive according to legend it was found by the founders of honey valley and legend has it that thousands of misfortunes will fall upon the town if the hive disappears on the eve of the holiday the beehive is kidnapped the squirrel chink sophies owl detectives assistant is blamed for this chink and his friends have to unravel the case find the real crook and return not only the golden hive but also peace to the valley,12.6427,8.8,2,1,0,1,0,0,0,1,0,0,0,0,0,0,1,0,0,1,0,0
22705,cheeky,2000,while scouting out apartments in london for her venetian boyfriend carla rents an apartment overlooking the thames there she meets a real estate agent by the name of moira,12.6377,5.7,267,0,0,0,1,0,0,1,0,0,0,0,0,0,0,0,1,0,0,0
585511,luck,2022,suddenly finding herself in the neverbeforeseen land of luck the unluckiest person in the world must unite with the magical creatures there to turn her luck around,12.6197,7.773,1803,1,1,1,0,0,0,1,0,0,0,0,0,0,0,0,0,0,0,0
181808,star wars the last jedi,2017,rey develops her newly discovered abilities with the guidance of luke skywalker who is unsettled by the strength of her powers meanwhile the resistance prepares to do battle with the first order,12.6185,6.775,15653,1,0,0,0,0,1,0,0,0,0,0,0,1,0,0,0,0,0,0
635302,demon slayer kimetsu no yaiba the movie mugen train,2020,tanjiro kamado joined with inosuke hashibira a boy raised by boars who wears a boars head and zenitsu agatsuma a scared boy who reveals his true power when he sleeps boards the infinity train on a new mission with the fire hashira kyojuro rengoku to defeat a demon who has been tormenting the people and killing the demon slayers who oppose it,12.6053,8.209,4103,0,1,1,0,0,1,0,0,0,1,0,0,0,0,0,0,0,0,0
615656,meg 2 the trench,2023,an exploratory dive into the deepest depths of the ocean of a daring research team spirals into chaos when a malevolent mining operation threatens their mission and forces them into a highstakes battle for survival,12.5739,6.43,3610,0,0,0,0,1,1,0,0,0,0,0,0,1,0,0,0,0,0,0
12153,white chicks,2004,two fbi agent brothers marcus and kevin copeland accidentally foil a drug bust to avoid being fired they accept a mission escorting a pair of socialites to the hamptonsbut when the girls are disfigured in a car accident they refuse to go left without options marcus and kevin decide to pose as the sisters transforming themselves from black men into rich white women,12.5734,6.93,4181,0,0,0,0,0,0,1,0,0,0,1,0,0,0,0,0,0,0,0
530385,midsommar,2019,several friends travel to sweden to study as anthropologists a summer festival that is held every ninety years in the remote hometown of one of them what begins as a dream vacation in a place where the sun never sets gradually turns into a dark nightmare as the mysterious inhabitants invite them to participate in their disturbing festive activities,12.5731,7.2,7440,0,0,0,1,1,0,0,0,0,0,0,0,0,1,0,0,0,0,0
424,schindlers list,1993,the true story of how businessman oskar schindler saved over a thousand jewish lives from the nazis while they worked as slaves in his factory during world war ii,12.5664,8.564,16480,0,0,0,1,0,0,0,1,0,0,0,0,0,0,0,0,0,1,0
637649,wrath of man,2021,a cold and mysterious new security guard for a los angeles cash truck company surprises his coworkers when he unleashes precision skills during a heist the crew is left wondering who he is and where he came from soon the marksmans ultimate motive becomes clear as he takes dramatic and irrevocable steps to settle a score,12.5557,7.611,5604,0,0,0,0,0,1,0,0,0,1,1,0,0,0,0,0,0,0,0
168259,furious 7,2015,deckard shaw seeks revenge against dominic toretto and his family for his comatose brother,12.5474,7.224,10835,1,0,0,1,0,1,0,0,0,1,1,0,0,0,0,0,0,0,0
91417,dragons gift of the night fury,2011,hiccup and toothless go on an exciting adventure and discover an island of new dragons,12.5461,7.2,395,1,0,1,0,0,0,1,0,0,0,0,0,0,0,0,0,1,0,0
777443,the electric state,2025,an orphaned teen hits the road with a mysterious robot to find her longlost brother teaming up with a smuggler and his wisecracking sidekick,12.5215,6.541,1209,1,0,0,0,0,1,0,0,0,0,0,0,1,0,0,0,0,0,0
419825,the phoenix tapes 97,2016,in 1997 four campers went missing during the phoenix lights incident and their bodies were never found the phoenix tapes 97 is comprised of their final footage this film is dedicated to the lives lost during the events displayed to their families and friends and to the authorities who continue to search for answers  the tapes were found by dustin millers father two years after dustin was mysteriously shot and killed at a traffic stop in texas peter miller believes his son was acting as a whistleblower and had smuggled the tapes from his classified government agency in an effort to expose the truth as to what really happened to the four missing campers seen in the tapes  after searching every newspaper and media publication around phoenix during that time period we only found one initial announcement that four campers were reported missing as well as a formal police report folder with local pd but the folder had no files inside,12.5155,6.271,35,0,0,0,0,1,0,0,0,0,1,0,0,1,0,0,0,0,0,0
41264,africa addio,1966,a chronicle of the violence that occurred in much of the african continent throughout the 1960s as many african countries were transitioning from colonial rule to other forms of government violent political upheavals were frequent revolutions in zanzibar and kenya in which thousands were killed are shown the violence not only political there is also extensive footage of hunters and poachers slaughtering different types of wild animals,12.5117,6.417,42,0,0,0,0,1,0,0,0,0,0,0,1,0,0,0,0,0,0,0
1607,a bronx tale,1993,set in the bronx during the tumultuous 1960s an adolescent boy is torn between his honest workingclass father and a violent yet charismatic crime boss complicating matters is the youngsters growing attraction  forbidden in his neighborhood  for a beautiful black girl,12.5038,7.876,2621,0,0,0,1,0,0,0,0,0,0,1,0,0,0,0,0,0,0,0
645710,the voyeurs,2021,when pippa and thomas move into their dream apartment they notice that their windows look directly into the apartment opposite  inviting them to witness the volatile relationship of the attractive couple across the street but what starts as a simple curiosity turns into fullblown obsession with increasingly dangerous consequences,12.4903,6.55,1017,0,0,0,0,0,0,0,0,0,1,0,0,0,0,0,0,0,0,0
365177,borderlands,2024,returning to her home planet an infamous bounty hunter forms an unexpected alliance with a team of unlikely heroes together they battle monsters and dangerous bandits to protect a young girl who holds the key to unimaginable power,12.4903,5.7,1225,0,0,0,0,0,1,1,0,0,0,0,0,1,0,0,0,0,0,0
545611,everything everywhere all at once,2022,an aging chinese immigrant is swept up in an insane adventure where she alone can save whats important to her by connecting with the lives she could have led in other universes,12.4815,7.758,7095,1,0,0,0,0,1,0,0,0,0,0,0,1,0,0,0,0,0,0
4488,friday the 13th,1980,camp counselors are stalked and murdered by an unknown assailant while trying to reopen a summer camp that was the site of a childs drowning,12.471,6.414,3077,0,0,0,0,1,0,0,0,0,0,0,0,0,0,0,0,0,0,0
91314,transformers age of extinction,2014,as humanity picks up the pieces after the battle of chicago a shadowy group reveals itself in an attempt to control the direction of historywhile an ancient powerful new menace sets earth in its crosshairs with help from cade yeager optimus prime and the autobots rise to meet their most fearsome challenge yet,12.4596,5.941,8343,1,0,0,0,0,1,0,0,0,0,0,0,1,0,0,0,0,0,0
1410082,sniper the last stand,2025,to stop an arms dealer from unleashing a deadly superweapon ace sniper brandon beckett and agent zero are deployed to costa verde to lead a group of elite soldiers against an unrelenting militia taking an untested sniper under his wing beckett faces his newest challenge giving orders instead of receiving them with both time and ammo running low in a race to save humanity the team must overcome all odds just to survive,12.4311,6.677,147,0,0,0,0,0,1,0,0,0,1,0,0,0,0,0,0,0,0,0
855,black hawk down,2001,when us rangers and an elite delta force team attempt to kidnap two underlings of a somali warlord their black hawk helicopters are shot down and the americans suffer heavy casualties facing intense fighting from the militia on the ground,12.4235,7.386,5951,0,0,0,0,0,1,0,1,0,0,0,0,0,0,0,0,0,1,0
75656,now you see me,2013,an fbi agent and an interpol detective track a team of illusionists who pull off bank heists during their performances and reward their audiences with the money,12.4148,7.333,15839,0,0,0,0,0,0,0,0,0,1,1,0,0,0,0,0,0,0,0
250546,annabelle,2014,a couple begins to experience terrifying supernatural occurrences involving a vintage doll shortly after their home is invaded by satanic cultists,12.3597,5.784,6234,0,0,0,0,1,0,0,0,0,0,0,0,0,0,0,0,0,0,0
381284,hidden figures,2016,the untold story of katherine g johnson dorothy vaughan and mary jackson  brilliant africanamerican women working at nasa and serving as the brains behind one of the greatest operations in history  the launch of astronaut john glenn into orbit the visionary trio crossed all gender and race lines to inspire generations to dream big,12.3424,8.054,9987,0,0,0,1,0,0,0,1,0,0,0,0,0,0,0,0,0,0,0
889737,joker folie  deux,2024,while struggling with his dual identity arthur fleck not only stumbles upon true love but also finds the music thats always been inside him,12.3357,5.432,2427,0,0,0,1,0,0,0,0,0,1,1,0,0,0,0,0,0,0,0
12155,alice in wonderland,2010,alice now 19 years old returns to the whimsical world she first entered as a child and embarks on a journey to discover her true destiny,12.3315,6.634,14261,1,1,0,0,0,0,0,0,0,0,0,0,0,0,0,0,1,0,0
297802,aquaman,2018,halfhuman halfatlantean arthur curry is taken on the journey of his lifetime to discover if he is worth of being a king,12.2935,6.876,14356,1,1,0,0,0,1,0,0,0,0,0,0,0,0,0,0,0,0,0
924525,fed up,2021,on her birthday carmela a 12yearold girl is forced to meet her father in a family meeting centre due to the case of gender violence that he has brought up against her mother,12.2746,0.0,0,0,0,0,1,0,0,0,0,0,0,0,0,0,0,0,0,0,0,0
1111873,abigail,2024,a group of criminals kidnap a teenage ballet dancer the daughter of a notorious gang leader in order to obtain a ransom of 50 million but over time they discover that she is not just an ordinary girl after the kidnappers begin to diminish one by one they discover to their increasing horror that they are locked inside with no normal little girl,12.2741,6.738,1589,0,0,0,0,1,0,0,0,0,1,0,0,0,0,0,0,0,0,0
1208808,turno nocturno,2024,a young nurse with a domestic abuse past starts working the night shift at a small hospital where during the night the ghost of a nurse materializes,12.2595,6.3,150,0,0,0,0,1,0,0,0,0,0,0,0,0,0,0,0,0,0,0
348893,boyka undisputed iv,2016,in the fourth installment of the fighting franchise boyka is shooting for the big leagues when an accidental death in the ring makes him question everything he stands for when he finds out the wife of the man he accidentally killed is in trouble boyka offers to fight in a series of impossible battles to free her from a life of servitude,12.2572,7.151,1374,0,0,0,1,0,1,0,0,0,1,0,0,0,0,0,0,0,0,0
634528,the marksman,2021,jim hansons quiet life is suddenly disturbed by two people crossing the usmexico border  a woman and her young son  desperate to flee a mexican cartel after a shootout leaves the mother dead jim becomes the boys reluctant defender he embraces his role as miguels protector and will stop at nothing to get him to safety as they go on the run from the relentless assassins,12.2468,6.807,1648,0,0,0,1,0,1,0,0,0,1,0,0,0,0,0,0,0,0,0
284052,doctor strange,2016,after his career is destroyed a brilliant but arrogant surgeon gets a new lease on life when a sorcerer takes him under her wing and trains him to defend the world against evil,12.2412,7.418,22576,1,1,0,0,0,1,0,0,0,0,0,0,0,0,0,0,0,0,0
466420,killers of the flower moon,2023,when oil is discovered in 1920s oklahoma under osage nation land the osage people are murdered one by oneuntil the fbi steps in to unravel the mystery,12.2199,7.425,3648,0,0,0,1,0,0,0,1,0,0,1,0,0,0,0,0,0,0,0
1471325,american thunder nascar to le mans,2025,nascar attempts to fulfill its leader jim frances childhood dream of racing a stock car in the historic 24hour race in le mans,12.2101,0.0,0,0,0,0,0,0,0,0,0,0,0,0,1,0,0,0,0,0,0,0
76341,mad max fury road,2015,an apocalyptic story set in the furthest reaches of our planet in a stark desert landscape where humanity is broken and most everyone is crazed fighting for the necessities of life within this world exist two rebels on the run who just might be able to restore order,12.1864,7.623,23151,1,0,0,0,0,1,0,0,0,0,0,0,1,0,0,0,0,0,0
85,raiders of the lost ark,1981,when dr indiana jones  the tweedsuited professor who just happens to be a celebrated archaeologist  is hired by the government to locate the legendary ark of the covenant he finds himself up against the entire nazi regime,12.183,7.924,12899,1,0,0,0,0,1,0,0,0,0,0,0,0,0,0,0,0,0,0
846817,night,2024,night has to trick the mother of the missing child into sleeping to save her soul,12.1251,10.0,0,0,0,1,0,0,0,0,0,0,0,0,0,0,0,0,0,0,0,0
970947,the shrouds,2025,inconsolable since the death of his wife karsh a prominent businessman invents a revolutionary and controversial technology that enables the living to monitor their dear departed in their shrouds one night multiple graves including that of karshs wife are desecrated and he sets out to track down the perpetrators,11.0497,5.976,82,0,0,0,1,1,0,0,0,0,1,0,0,1,0,0,0,0,0,0
8681,taken,2008,bryan mills a former government operative is trying to reconnect with his teenage daughter kim after reluctantly agreeing with his exwife to let kim go to paris on vacation with a friend his worst nightmare comes true while on the phone with his daughter shortly after she arrives in paris she and her friend are abducted by a gang of human traffickers working against the clock bryan relies on his extensive training and skills to track down the ruthless gang that abducted her and launch a oneman war to rescue his daughter,12.1167,7.395,11516,0,0,0,0,0,1,0,0,0,1,0,0,0,0,0,0,0,0,0
93685,swingers,2002,despite dianas insecure nature she and her husband julian agree with the idea to sexually experiment with another couple they put out an ad on the net to which the well experienced alex and timo react we follow diana and julian as they prepare for the arrival of alex and timo who they have invited to their home for the weekend diana is nervous as soon as she is confronted with the selfconfident and ravishingly sexy alex her insecurity increases even more timo seems disinterested a sharp contrast to the boyish excitement of julian but as night falls and their sexual exploration begins we notice timo may not be as casual as he initially seemed and diana on the other hand contains hidden strength and so we realize theres more to swingers than just sex swingers could your relationship stand the test,12.1157,5.8,60,0,0,0,1,0,0,0,0,0,0,0,0,0,0,0,1,0,0,0
10020,beauty and the beast,1991,follow the adventures of belle a bright young woman who finds herself in the castle of a prince whos been turned into a mysterious beast with the help of the castles enchanted staff belle soon learns the most important lesson of all  that true beauty comes from within,12.109,7.731,10177,0,1,1,0,0,0,0,0,0,0,0,0,0,0,0,1,1,0,0
20352,despicable me,2010,villainous gru lives up to his reputation as a despicable deplorable and downright unlikable guy when he hatches a plan to steal the moon from the sky but he has a tough time staying on task after three orphans land in his care,12.093,7.249,15428,0,0,1,0,0,0,1,0,0,0,0,0,0,0,0,0,1,0,0
585083,hotel transylvania transformania,2022,when van helsings mysterious invention the monsterfication ray goes haywire drac and his monster pals are all transformed into humans and johnny becomes a monster in their new mismatched bodies drac and johnny must team up and race across the globe to find a cure before its too late and before they drive each other crazy,11.9812,7.067,2866,1,1,1,0,0,0,1,0,0,0,0,0,0,0,0,0,1,0,0
1245571,alappuzha gymkhana,2025,a group of youngsters after failing their plus two exams aims to join a common college through the sports quota they choose boxing as their sport by luck they manage to survive the districtlevel competitions but what will happen at the higher levels,12.0471,6.115,13,0,0,0,1,0,1,1,0,0,0,0,0,0,0,0,0,0,0,0
792307,poor things,2023,brought back to life by an unorthodox scientist a young woman runs off with a lawyer on a whirlwind adventure across the continents free from the prejudices of her times she grows steadfast in her purpose to stand for equality and liberation,12.046,7.685,4774,0,0,0,0,0,0,1,0,0,0,0,0,1,0,0,1,0,0,0
260514,cars 3,2017,blindsided by a new generation of blazingfast racers the legendary lightning mcqueen is suddenly pushed out of the sport he loves to get back in the game he will need the help of an eager young race technician with her own plan to win inspiration from the late fabulous hudson hornet and a few unexpected turns proving that 95 isnt through yet will test the heart of a champion on piston cup racings biggest stage,12.0249,6.854,6037,1,0,1,0,0,0,1,0,0,0,0,0,0,0,0,0,1,0,0
408866,reborn,2016,a former special forces operative struggling to contain the destructive impulses of his past goes on a rampage against a squad of ruthless assassins,11.6496,7.1,224,0,0,0,0,0,1,0,0,0,0,1,0,0,0,0,0,0,0,0
921436,escape,2024,after completing his required decade of military service and being honored as a hero a north korean sergeant makes a sudden shocking attempt to defect to the south risking life and limb for the chance to finally determine his own destiny,11.9976,7.2,50,0,0,0,1,0,1,0,0,0,1,0,0,0,0,0,0,0,0,0
