id,title,release_date,overview,popularity,vote_average,vote_count,Adventure,Fantasy,Animation,Drama,Horror,Action,Comedy,History,Western,Thriller,Crime,Documentary,Science Fiction,Mystery,Music,Romance,Family,War,TV Movie
574475,final destination bloodlines,2025,plagued by a violent recurring nightmare college student stefanie heads home to track down the one person who might be able to break the cycle and save her family from the grisly demise that inevitably awaits them all,1160.8402,7.184,850,0,0,0,0,1,0,0,0,0,0,0,0,0,1,0,0,0,0,0
1087891,the amateur,2025,after his life is turned upside down when his wife is killed in a london terrorist attack a brilliant but introverted cia decoder takes matters into his own hands when his supervisors refuse to take action,493.4736,6.907,524,0,0,0,0,0,1,0,0,0,1,0,0,0,0,0,0,0,0,0
1426776,straw,2025,what will be her last straw a devastatingly bad day pushes a hardworking single mother to the breaking point  and into a shocking act of desperation,458.5632,8.097,486,0,0,0,1,0,0,0,0,0,1,1,0,0,0,0,0,0,0,0
552524,lilo  stitch,2025,the wildly funny and touching story of a lonely hawaiian girl and the fugitive alien who helps to mend her broken family,411.1899,7.1,651,1,0,0,0,0,0,1,0,0,0,0,0,1,0,0,0,1,0,0
870028,the accountant,2025,when an old acquaintance is murdered wolff is compelled to solve the case realizing more extreme measures are necessary wolff recruits his estranged and highly lethal brother brax to help in partnership with marybeth medina they uncover a deadly conspiracy becoming targets of a ruthless network of killers who will stop at nothing to keep their secrets buried,310.9376,7.22,821,0,0,0,0,0,0,0,0,0,1,1,0,0,1,0,0,0,0,0
1376434,predator killer of killers,2025,while three of the fiercest warriors in human historya viking raider a ninja in feudal japan and a wwii pilotare killers in their own right they are merely prey for their new opponent the ultimate killer of killers,369.2901,7.988,531,0,0,1,0,0,1,0,0,0,0,0,0,1,0,0,0,0,0,0
1087192,how to train your dragon,2025,on the rugged isle of berk where vikings and dragons have been bitter enemies for generations hiccup stands apart defying centuries of tradition when he befriends toothless a feared night fury dragon their unlikely bond reveals the true nature of dragons challenging the very foundations of viking society,335.7287,8.0,262,0,1,0,0,0,1,0,0,0,0,0,0,0,0,0,0,1,0,0
1379587,utopia,2024,a soldier searching for his missing wife breaks into a hightech facility believing shes been caught in a human trafficking ring but beyond its walls he finds a surreal futuristic fantasy park where reality and illusion blur as he navigates this seductive and dangerous world a shocking truth pulls him deeper into a deadly game where nothing is as it seems,299.3717,5.136,33,0,0,0,0,0,1,0,0,0,1,0,0,1,1,0,0,0,0,0
1240475,hunt the wicked,2024,the film tells the story of narcotics police officer huang mingjin and the mysterious figure wei yunzhou through completely different means and methods in the process of calculating and wrestling with each other they tear apart the facade of urban tranquility exposing the underground drug network woven by the hidden hand long wang and ultimately eradicate the darkness with the sword of justice revealing the dawn of light,284.9678,4.8,6,0,0,0,0,0,1,0,0,0,0,0,0,0,0,0,0,0,0,0
1239193,deep cover,2025,kat is an improv comedy teacher beginning to question if shes missed her shot at success when an undercover cop offers her the role of a lifetime she recruits two of her students to infiltrate londons gangland by impersonating dangerous criminals,276.3244,6.8,122,0,0,0,0,0,1,1,0,0,0,1,0,0,0,0,0,0,0,0
1315988,mikaela,2025,during the eve of the 6th of january a recordbreaking snowstorm sweeps across spain in the midst of its chaos a group of robbers seizes the opportunity to hijack an armoured van a few meters away is leo a finished policeman who has nothing to lose with the unexpected aid of a young woman he will try to stop the band from running away with their loot,202.1852,6.25,48,0,0,0,0,0,1,0,0,0,1,0,0,0,0,0,0,0,0,0
1450599,ko,2025,a former fighter must find the missing son of an opponent he accidentally killed years ago taking on a brutally violent crime gang in marseille,197.0575,6.66,119,1,0,0,1,0,1,0,0,0,0,0,0,0,0,0,0,0,0,0
1289601,life after fighting,2024,retired martial arts world champion alex faulkner has settled into a simple life when the disappearance of two of his students leads to an unthinkable discovery close to home just when all hope of finding the children is lost he locates the imprisoned girls and unsurfaces an international child trafficking operation which draws him back into the fight of his life against those behind it,233.114,6.944,36,0,0,0,1,0,1,0,0,0,1,0,0,0,0,0,0,0,0,0
1233413,sinners,2025,trying to leave their troubled lives behind twin brothers return to their hometown to start again only to discover that an even greater evil is waiting to welcome them back,223.5231,7.569,1514,0,1,0,0,1,0,0,0,0,1,0,0,0,0,0,0,0,0,0
1017163,the roundup punishment,2024,monster cop ma seokdo investigates an illegal online gambling business led by a former sts baek and an it genius ceo chang ma proposes an unexpected alliance to jang and begins hunting down the criminals,221.2391,6.831,139,0,0,0,1,0,1,1,0,0,1,1,0,0,0,0,0,0,0,0
1225916,3o an endless story,2023,this movie is a gift for the 2023 esca high school thirdyear students despite a challenging year we know it wasnt all about studying and sadness,187.5426,8.375,4,1,0,0,0,0,0,0,0,0,0,0,0,0,0,0,0,1,0,0
950387,a minecraft movie,2025,four misfits find themselves struggling with ordinary problems when they are suddenly pulled through a mysterious portal into the overworld a bizarre cubic wonderland that thrives on imagination to get back home theyll have to master this world while embarking on a magical quest with an unexpected expert crafter steve,183.0392,6.5,1801,1,1,0,0,0,0,1,0,0,0,0,0,0,0,0,0,1,0,0
666154,kayara,2025,a courageous and athletic teenager kayara dreams that she is destined to be the first female to break into the league of chasquis  the official messengers of the incan empire as she learns what it takes to be a chasqui along with its challenges she tackles every mission she gets and discovers the ancient stories of her land and her people,186.4767,7.6,46,1,0,1,0,0,0,0,0,0,0,0,0,0,0,0,0,1,0,0
541671,ballerina,2025,taking place during the events of john wick chapter 3  parabellum eve macarro begins her training in the assassin traditions of the ruska roma,153.7941,7.083,309,0,0,0,0,0,1,0,0,0,1,1,0,0,0,0,0,0,0,0
575265,mission impossible  the final reckoning,2025,ethan hunt and team continue their search for the terrifying ai known as the entity  which has infiltrated intelligence networks all over the globe  with the worlds governments and a mysterious ghost from hunts past on their trail joined by new allies and armed with the means to shut the entity down for good hunt is in a race against time to prevent the world as we know it from changing forever,127.6214,7.155,793,1,0,0,0,0,1,0,0,0,1,0,0,0,0,0,0,0,0,0
447273,snow white,2025,following the benevolent kings disappearance the evil queen dominated the once fair land with a cruel streak princess snow white flees the castle when the queen in her jealousy over snow whites inner beauty tries to kill her deep into the dark woods she stumbles upon seven magical dwarves and a young bandit named jonathan together they strive to survive the queens relentless pursuit and aspire to take back the kingdom,117.9741,4.277,1128,0,1,0,0,0,0,0,0,0,0,0,0,0,0,0,0,1,0,0
757725,shadow force,2025,kyrah and isaac were once the leaders of a multinational special forces group called shadow force they broke the rules by falling in love and in order to protect their son they go underground with a large bounty on their heads and the vengeful shadow force hot on their trail one familys fight becomes allout war,107.2776,6.37,77,0,0,0,1,0,1,0,0,0,1,0,0,0,0,0,0,0,0,0
1284120,the ugly stepsister,2025,in a fairytale kingdom where beauty is a brutal business elvira battles to compete with her incredibly beautiful stepsister and she will go to any length to catch the princes eye,119.6417,7.103,179,0,1,0,1,1,0,1,0,0,0,0,0,0,0,0,0,0,0,0
1097311,echo valley,2025,kate lives a secluded lifeuntil her troubled daughter shows up frightened and covered in someone elses blood as kate unravels the shocking truth she learns just how far a mother will go to try to save her child,122.2015,6.566,91,0,0,0,1,0,0,0,0,0,1,0,0,0,0,0,0,0,0,0
1225915,jewel thief  the heist begins,2025,in this highoctane battle of wits and wills ingenious con artist rehan devises a diamond heist while trying to outsmart rajan his sadistic adversary,103.9181,6.669,62,0,0,0,0,0,1,0,0,0,1,0,0,0,0,0,0,0,0,0
1241436,warfare,2025,a platoon of navy seals embarks on a dangerous mission in ramadi iraq with the chaos and brotherhood of war retold through their memories of the event,93.9943,7.2,571,0,0,0,0,0,1,0,0,0,0,0,0,0,0,0,0,0,1,0
1241982,moana 2,2024,after receiving an unexpected call from her wayfinding ancestors moana journeys alongside maui and a new crew to the far seas of oceania and into dangerous longlost waters for an adventure unlike anything shes ever faced,90.541,7.1,2473,1,0,1,0,0,0,1,0,0,0,0,0,0,0,0,0,1,0,0
1199974,prvulos children of the apocalypse,2024,in a dystopian future ravaged by a viral apocalypse three young brotherssalvador oliver and benjaminfind themselves isolated in a remote cabin deep within the woods as they navigate this desolate world they harbor a dark and disturbing secret in their basement a presence they must feed to ensure their own survival,82.6275,6.929,21,0,0,0,0,1,0,0,0,0,0,0,0,0,0,0,0,0,0,0
1403735,laila,2025,sonu model a renowned beautician from the old city is forced to disguise himself as laila leading to a series of comedic romantic and actionpacked events chaos ensues in this hilarious laugh riot,87.557,4.75,4,0,0,0,0,0,0,1,0,0,0,0,0,0,0,0,1,0,0,0
1232933,fear below,2025,a ragtag team of divers attempting to salvage a sunken car from a river are thwarted by a highly aggressive bull shark,78.8801,6.728,57,1,0,0,0,1,1,0,0,0,1,0,0,0,0,0,0,0,0,0
986056,thunderbolts,2025,after finding themselves ensnared in a death trap seven disillusioned castoffs must embark on a dangerous mission that will force them to confront the darkest corners of their pasts,86.1811,7.401,1135,1,0,0,0,0,1,0,0,0,0,0,0,1,0,0,0,0,0,0
10191,how to train your dragon,2010,as the son of a viking leader on the cusp of manhood shy hiccup horrendous haddock iii faces a rite of passage he must kill a dragon to prove his warrior mettle but after downing a feared dragon he realizes that he no longer wants to destroy it and instead befriends the beast  which he names toothless  much to the chagrin of his warrior father,89.634,7.845,13489,1,1,1,0,0,0,0,0,0,0,0,0,0,0,0,0,1,0,0
1411773,the last stand of ellen cole,2024,when an evil contractor goes to extreme measures to evict a testy tenant who is standing in the way of his new project he fails to take into account that this seemingly harmless old woman is a trained killer and will do anything to protect her beloved home,77.0686,8.119,21,1,0,0,0,0,1,0,0,0,0,0,0,0,0,0,0,0,0,0
56379,beach house,1977,summer sunday at a small beach house at the coast of rome many people and stories womens basketball team two sportsobsessed soldiers two men with their girlfriends and the priest with a big secret an elderly couple with their pregnant granddaughter and engagemented couple wanting to have sex for the first time,49.1376,6.5,64,0,0,0,0,0,0,1,0,0,0,0,0,0,0,0,0,0,0,0
822119,captain america brave new world,2025,after meeting with newly elected us president thaddeus ross sam finds himself in the middle of an international incident he must discover the reason behind a nefarious global plot before the true mastermind has the entire world seeing red,75.1426,6.07,2180,0,0,0,0,0,1,0,0,0,1,0,0,1,0,0,0,0,0,0
1257960,sikandar,2025,a tragic accident pushes the powerful sikandar to protect the less fortunate by standing up to corruption and greed  using any means necessary,67.8184,5.0,50,0,0,0,1,0,1,0,0,0,0,0,0,0,0,0,0,0,0,0
1232546,until dawn,2025,one year after her sister melanie mysteriously disappeared clover and her friends head into the remote valley where she vanished in search of answers exploring an abandoned visitor center they find themselves stalked by a masked killer and horrifically murdered one by oneonly to wake up and find themselves back at the beginning of the same evening,72.9629,6.6,681,0,0,0,0,1,0,0,0,0,0,0,0,0,1,0,0,0,0,0
324544,in the lost lands,2025,a queen sends the powerful and feared sorceress gray alys to the ghostly wilderness of the lost lands in search of a magical power where she and her guide the drifter boyce must outwit and outfight both man and demon,68.5859,6.489,482,1,1,0,0,0,1,0,0,0,0,0,0,0,0,0,0,0,0,0
1011477,karate kid legends,2025,after a family tragedy kung fu prodigy li fong is uprooted from his home in beijing and forced to move to new york city with his mother when a new friend needs his help li enters a karate competition  but his skills alone arent enough lis kung fu teacher mr han enlists original karate kid daniel larusso for help and li learns a new way to fight merging their two styles into one for the ultimate martial arts showdown,69.3534,6.935,139,1,0,0,1,0,1,0,0,0,0,0,0,0,0,0,0,0,0,0
947891,my old ass,2024,an 18th birthday mushroom trip brings freespirited elliott facetoface with her wisecracking 39yearold self but when elliotts old ass starts handing out warnings about what her younger self should and shouldnt do elliott realizes she has to rethink everything about family love and whats becoming a transformative summer,66.9326,6.841,330,0,0,0,1,0,0,1,0,0,0,0,0,0,0,0,0,0,0,0
1426680,our times,2025,husband and wife nora and hctors scientific breakthrough lets them time travel from 1966 to 2025 as hctor struggles nora thrivesbut at what cost,68.4453,6.892,37,0,0,0,0,0,0,1,0,0,0,0,0,1,0,0,1,0,0,0
1421982,kiff lore of the ring light,2025,kiff and her friends go on an adventure to destroy a ring light of immense power,67.3309,5.6,5,1,1,1,0,0,0,1,0,0,0,0,0,0,0,1,0,1,0,0
11544,lilo  stitch,2002,as stitch a runaway genetic experiment from a faraway planet wreaks havoc on the hawaiian islands he becomes the mischievous adopted alien puppy of an independent little girl named lilo and learns about loyalty friendship and ohana the hawaiian tradition of family,65.3934,7.6,6625,0,0,1,0,0,0,1,0,0,0,0,0,0,0,0,0,1,0,0
1010581,my fault,2023,noah must leave her city boyfriend and friends to move into william leisters mansion the flashy and wealthy husband of her mother rafaela as a proud and independent 17 year old noah resists living in a mansion surrounded by luxury however it is there where she meets nick her new stepbrother and the clash of their strong personalities becomes evident from the very beginning,63.9298,7.8,3711,0,0,0,1,0,0,0,0,0,0,0,0,0,0,0,1,0,0,0
1100988,28 years later,2025,twentyeight years since the rage virus escaped a biological weapons laboratory now still in a ruthlessly enforced quarantine some have found ways to exist amidst the infected one such group lives on a small island connected to the mainland by a single heavilydefended causeway when one member departs on a mission into the dark heart of the mainland he discovers secrets wonders and horrors that have mutated not only the infected but other survivors as well,65.7596,7.7,9,0,0,0,0,1,0,0,0,0,1,0,0,1,0,0,0,0,0,0
1241894,woodwalkers,2024,humans who can shapeshift into animals struggle to integrate with others without giving away their special abilities as a group they strive to inform and institute change in the world perspective of deforestation and the importance of natural habitats however when that cant happen they are forced to take matters into their own hands,56.8249,6.204,27,0,1,0,0,0,0,0,0,0,0,0,0,0,0,0,0,1,0,0
589018,savages,2024,in borneo near the tropical forest kria rescues a baby orangutang in the palm oil plantation where her father works krias cousin sela comes to live with them seeking refuge from the conflict between his indigenous tribe and the logging companies kria sela and the little orangutang now named oshi will have to fight against their forests destruction,65.0022,6.977,22,1,0,1,1,0,0,0,0,0,0,0,0,0,0,0,0,1,0,0
939243,sonic the hedgehog 3,2024,sonic knuckles and tails reunite against a powerful new adversary shadow a mysterious villain with powers unlike anything they have faced before with their abilities outmatched in every way team sonic must seek out an unlikely alliance in hopes of stopping shadow and protecting the planet,62.4555,7.714,2686,0,0,0,0,0,1,1,0,0,0,0,0,1,0,0,0,1,0,0
82702,how to train your dragon 2,2014,five years have passed since hiccup and toothless united the dragons and vikings of berk now they spend their time charting unmapped territories during one of their adventures the pair discover a secret cave that houses hundreds of wild dragons  and a mysterious dragon rider hiccup and toothless find themselves at the center of a battle to protect berk from a powerhungry warrior,68.4745,7.674,9868,1,1,1,0,0,1,1,0,0,0,0,0,0,0,0,0,1,0,0
715287,stepmoms desire,2020,sangjin who was envious of her neighbor after getting a beautiful wife ask your wifes friend gian to take over the sons extracurricular teacher sangjin who left work early accidentally sees gians shower a man who wants to have sex with his sons tutor and a son who wants to have a good time with a young stepmom jian and jinhee who want money are disappointed with her husband and binjin gives her body to a young son,61.117,7.15,20,0,0,0,1,0,0,0,0,0,0,0,0,0,0,0,1,0,0,0
30484,warrior queen,1987,in ancient pompeii slaves are bought and sold for household chores and sex a mysterious queen moves among the elite meantime secretly helping the slaves to escape eventually her life is also in jeopardy and as the volcano erupts she and the slaves attempt to escape while being chased by the military,40.9902,3.4,30,1,0,0,0,0,1,0,1,0,0,0,0,0,0,0,0,0,0,0
568770,the containment,2025,a girl is possessed by a dark and mysterious entity she will fight with all the elements at her disposal to get rid of it neither her mother nor traditional medicine nor a supposed expert in exorcisms will be able to make the demon disappear until a nun gets involved in the case and sows a doubt more terrible than the possession itself,51.8172,7.538,13,0,0,0,0,1,0,0,0,0,0,0,0,0,1,0,0,0,0,0
977294,tin soldier,2025,an exspecial forces operative seeks revenge against a cult leader who has corrupted his former comrades the shinjas this leader known as the bokushi promises veterans a purpose and protection but is revealed to be a destructive influence the exsoldier nash cavanaugh joins forces with military operative emmanuel ashburn to infiltrate the bokushis fortress and expose his reign of terror,54.0221,4.9,55,0,0,0,0,0,1,0,0,0,1,0,0,0,0,0,0,0,0,0
1233069,exterritorial,2025,when her son vanishes inside a us consulate exspecial forces soldier sara does everything in her power to find him  and uncovers a dark conspiracy,50.6909,6.756,475,0,0,0,0,0,1,0,0,0,1,0,0,0,0,0,0,0,0,0
896536,the legend of ochi,2025,in a remote village on the island of carpathia a shy farm girl named yuri is raised to fear an elusive animal species known as ochi but when yuri discovers a wounded baby ochi has been left behind she escapes on a quest to bring him home,49.9396,6.386,123,1,1,0,0,0,0,0,0,0,0,0,0,0,0,0,0,1,0,0
762509,mufasa the lion king,2024,mufasa a cub lost and alone meets a sympathetic lion named taka the heir to a royal bloodline the chance meeting sets in motion an expansive journey of a group of misfits searching for their destiny,52.2563,7.392,2205,1,0,1,0,0,0,0,0,0,0,0,0,0,0,0,0,1,0,0
7451,xxx,2002,xander cage is your standard adrenaline junkie with no fear and a lousy attitude when the us government recruits him to go on a mission hes not exactly thrilled his mission to gather information on an organization that may just be planning the destruction of the world led by the nihilistic yorgi,57.1179,5.945,4437,1,0,0,0,0,1,0,0,0,1,1,0,0,0,0,0,0,0,0
1040159,my massive cock,2022,an extralarge penis is an object of desire for many but for some men extralarge seriously complicates their lives and relationships and penis reduction surgery seems the only answer,44.9082,5.8,8,0,0,0,0,0,0,0,0,0,0,0,1,0,0,0,0,0,0,0
1022787,elio,2025,elio a space fanatic with an active imagination finds himself on a cosmic misadventure where he must form new bonds with eccentric alien lifeforms navigate a crisis of intergalactic proportions and somehow discover who he is truly meant to be,49.9183,7.4,12,1,0,1,0,0,0,1,0,0,0,0,0,1,0,0,0,1,0,0
1426306,titan the oceangate submersible disaster,2025,oceangates titan tourist submersible imploded in 2023 on a deepsea dive to the titanic this documentary details how a bold vision ended in tragedy,49.8385,7.095,63,0,0,0,1,0,0,0,0,0,0,0,1,0,0,0,0,0,0,0
56379,beach house,1977,summer sunday at a small beach house at the coast of rome many people and stories womens basketball team two sportsobsessed soldiers two men with their girlfriends and the priest with a big secret an elderly couple with their pregnant granddaughter and engagemented couple wanting to have sex for the first time,49.1376,6.474,65,0,0,0,0,0,0,1,0,0,0,0,0,0,0,0,0,0,0,0
950396,the gorge,2025,two highly trained operatives grow close from a distance after being sent to guard opposite sides of a mysterious gorge when an evil below emerges they must work together to survive what lies within,48.241,7.711,2703,0,0,0,0,0,0,0,0,0,1,0,0,1,0,0,1,0,0,0
1303162,cells at work,2024,a novice red blood cell and a relentless white blood cell work together to protect their human from invading germs pathogens and other threats,48.07,7.524,21,1,1,0,0,0,1,1,0,0,0,0,0,0,0,0,0,0,0,0
1136867,materialists,2025,a young ambitious new york city matchmaker finds herself torn between the perfect match and her imperfect ex,47.7239,7.2,25,0,0,0,1,0,0,0,0,0,0,0,0,0,0,0,1,0,0,0
1094473,bambi a life in the woods,2024,the life of bambi a male roe deer from his birth through childhood the loss of his mother the finding of a mate the lessons he learns from his father and the experience he gains about the dangers posed by human hunters in the forest,47.3987,6.036,28,1,0,0,0,0,0,0,0,0,0,0,1,0,0,0,0,1,0,0
897160,brave citizen,2023,an expelled boxing champion who now is a highschool teacher witnesses intolerable violence and throws her first punch to build justice against it while putting on a mask,45.6498,6.947,47,0,0,0,1,0,1,1,0,0,0,0,0,0,0,0,0,0,0,0
1022789,inside out 2,2024,teenager rileys mind headquarters is undergoing a sudden demolition to make room for something entirely unexpected new emotions joy sadness anger fear and disgust whove long been running a successful operation by all accounts arent sure how to feel when anxiety shows up and it looks like shes not alone,45.6368,7.553,5922,1,0,1,0,0,0,1,0,0,0,0,0,0,0,0,0,1,0,0
1234821,jurassic world rebirth,2025,five years after the events of jurassic world dominion covert operations expert zora bennett is contracted to lead a skilled team on a topsecret mission to secure genetic material from the worlds three most massive dinosaurs when zoras operation intersects with a civilian family whose boating expedition was capsized they all find themselves stranded on an island where they come facetoface with a sinister shocking discovery thats been hidden from the world for decades,45.5036,0.0,0,1,0,0,0,0,1,0,0,0,0,0,0,1,0,0,0,0,0,0
1156593,your fault,2024,the love between noah and nick seems unwavering despite their parents attempts to separate them but his job and her entry into college open up their lives to new relationships that will shake the foundations of both their relationship and the leister family itself,45.066,7.132,1277,0,0,0,1,0,0,0,0,0,0,0,0,0,0,0,1,0,0,0
170,28 days later,2002,twentyeight days after a killer virus was accidentally unleashed from a british research facility a small group of london survivors are caught in a desperate struggle to protect themselves from the infected carried by animals and humans the virus turns those it infects into homicidal maniacs  and its absolutely impossible to contain,44.2571,7.238,7196,0,0,0,0,1,0,0,0,0,1,0,0,1,0,0,0,0,0,0
1297028,rosario,2025,wall street stockbroker rosario fuentes returns to her grandmothers apartment after her sudden death while sorting through her belongings rosario discovers a hidden chamber thats filled with occult artifacts tied to dark generational rituals as supernatural occurrences begin to plague her she must confront her familys buried secrets and face the truth about the sacrifices and choices they made,44.0842,5.4,39,0,0,0,0,1,0,0,0,0,0,0,0,0,0,0,0,0,0,0
533535,deadpool  wolverine,2024,a listless wade wilson toils away in civilian life with his days as the morally flexible mercenary deadpool behind him but when his homeworld faces an existential threat wade must reluctantly suitup again with an even more reluctant wolverine,43.7074,7.592,7370,0,0,0,0,0,1,1,0,0,0,0,0,1,0,0,0,0,0,0
1219555,wunderschner,2025,the main thing is sexy  no matter whether thin fat what skin color young old we can all be sexy in different ways almost every woman grows up having to work on herself in order to remain desirable why what if we stopped pushing ourselves into a sexy pose with all our might what if we no longer fought for the right to be sexy but were truly free what if we stopped investing all our time and energy in being heard and the world started to hear us a modern movie about modern women and men  who might be able to find a common language,43.6118,8.219,16,0,0,0,1,0,0,1,0,0,0,0,0,0,0,0,1,0,0,0
